answers,creation_date,len,postid,question,ratio,raw,tags,title,uniq,words,probability
agre bdonlan context http request anonym packet vagu ambigu best mayb mean referr code? requir http-authentication? need establish session key abl access specif url requesting? need actual technic detail client thing anonym packet standard network parlanc client firewal make term miscommun somewher along line messag got either go need clarif client firewal vendor document mean app authent firewal link provid wealth inform concern tmg product client probabl configur requir user authent whenev request web access everi web session requir authent use method note follow anonym web access disabl forefront tmg request user credenti valid check request firewal polici user fail authent access request deni method defin per network non-interact client window updat client cannot authent therefor deni access user open web browser tri access web page pop-up window ask credenti firewal intercept web request sent authent page user authent firewal pass web traffic autom app authent firewal firewal drop packet traffic classifi anonym sorri know solut make applic authent firewal app goe specif url site oper whitelist accord page get error 407 proxi authent requir curl try ad option curl initi still problem ask user network credenti interact,2011-02-04 16:09:56.883 UTC,251,4900153,got word today one client firewal block http request [software] send anonym packet firewal microsoft tmg firewal firewal drop packet anonym access [not] allow connect code use c++ curl fallback iedownloadtofil need write origin code realli network programm came help question anonym packets? curl caus anonym packets? find inform solv problem? thank,0.11553784860557768,29,c++ curl ip network-programming packet,program send anonym ip packet stop,5,firewall|authentication|credential|validate|whitelist,0.480765700340271
need write gina dll xp credenti provid vista / seven,2010-05-06 01:21:21.033 UTC,43,2777833,work program enter usernam password someon plug usb know enter window log password idea program run find usb plug keybd_ev enter password hit enter program run,0.13953488372093023,6,c++ login windows,program log user window,4,login|username|password|credential,0.48068588972091675
window password file lock oper system run easili access easiest workaround boot cd usb devic run password file extract tool found openwal project tri techniqu recent sure still work one time definit guess probabl still call user account target comput account right chang user password e.g anoth normal user account call pass among thing user old password sinc call account allow chang user password call alway fail interest error code fail pass old password recogn system i.e correct password account call fail password pass incorrect i.e recogn account fail workstat domain password sync- automatically.if probabl try open connect specif user &amp password check connect open password correct machin password correct,2010-07-07 16:01:54.967 UTC,144,3196600,hash valu window password specif local user? win32 api be? want know actual password hash valu password abl tell workstations/serv password specif user pleas advis thank,0.16666666666666666,24,c# c++ hash passwords winapi,window hash password,3,hash|password|user account,0.4791904091835022
suggest first make clear auth dropbox firefox chrome debugg tool easi figur face obfusc javscript code better first check dropbox openapi develop support access dropbox core api via oauth user app complet oauth flow browser author app cach oauth credenti keep use,2013-08-05 08:48:20.567 UTC,83,18053987,want creat desktop app connect dropbox upload/ download files.i use lioauth authent process libcurl handl http request c++ environ visual 2010 still block authent process! insert login/passwd token paramet call dropbox api? suggest,0.1566265060240964,13,c++ dropbox libcurl,authent dropbox login/passwd libcurl c,7,authentication|login|oauth|obfuscate|scripting|authorise|credential,0.4758875370025635
mayb enumer window system find one text window secur find children hwnd search text field setwindowtext hwnd etc . send messag ok button tell us work,2014-02-12 10:02:00.56 UTC,69,21724553,open start menu run nameofserv pass two string user name password put form login simul enter press? grant login stop test continu put string try enter program c c++ c#?obvious academ thank advanc,0.11594202898550725,8,bots c c++,program test usernam password author requir server,6,username|password|authorise|user name|login|security,0.47504737973213196
solv issue? click link suppli answer found note paramet onlin ident credenti plaintext password user name format providernameusernam credenti sec_winnt_auth_identity_ex2 structur user name encod string usernam paramet output function call sspiencodeauthidentityasstr function alter ego - sspiencodestringsasauthident - look,2016-03-01 09:19:46.3 UTC,83,35718854,issu tri domain user authent custom credenti provid microsoft sampl variabl check normal true case howev connect domain tile seem even suggest format accept credenti serial possibl support well sure method problem howev document https://msdn.microsoft.com/en-us/library/windows/desktop/aa374802v=vs.85.aspx thank,0.18072289156626506,15,c++ credential-providers credui,window 8 credenti provid domain user,6,credential|authentication|password|user name|username|encode,0.474925696849823
msdn page say caution user name password specifi without specifi authent flag user name password transmit network plaintext secur risk specifi user name password without specifi authent flag use flag mean request secur authent flag winnt provid use nt lan manag ntlm authent client activ directori kerbero possibl ntlm authent client user name password null adsi bind object use secur context call thread either secur context user account applic run client user account call thread repres ntlm kerbero protocol encrypt password want usernam encrypt well need ssl requir certif server setup domain alway packet sniffer verifi inform encrypt,2012-12-03 13:33:24.557 UTC,122,13684346,get detail activ directori via ldap url adsopenobject msdn librari doubt whether given password encrypt connect domain control,0.28688524590163933,35,c++ ldap windows,adsopenobject password encrypt,12,ldap|password|encrypt|user name|authentication|security|kerberos|user account|username|ssl|certificate|snif,0.47432512044906616
error gener one paramet accept acceptsecuritycontext pass wrong valu valu accept asc_req_allocate_memori asc_req_connect asc_req_deleg asc_req_extended_error asc_req_replay_detect asc_req_sequence_detect asc_req_stream document link provid question say client support paramet pass therein proce say flag valid client suggest read post care understand avail make sure pass valid valu begin check flag use use client server-onli,2017-03-17 12:50:44.673 UTC,109,42858061,current use secur support provid interfac sspi valid user credenti describ articl mircrosoft valid user credenti microsoft oper system work gener well face issu window 10 machin function acceptsecuritycontext use gener server context ssplogonus method return error sec_e_unsupported_funct 0x80090302l altern valid user credenti window 10 use microsoft api,0.1559633027522936,17,api c++ credentials passwords windows-10,valid user credenti window 10,6,credential|password|validate|security|delegation|availability,0.47221890091896057
usernam exist databa statement fal i.e record return build string queri better prepar queri instead take care special charact usernam password protect inject attack restructur code edit need check know usernam alreadi exist databa time point,2020-04-29 02:11:28,69,61493076,need insert usernam password valu databa qt creator two usernam check proceed insert run code chang databa cant seem find problem clueless proceed improv code,0.14492753623188406,10,c++ qt-creator,insert valu mysql databa qt creator,5,username|password|protect|inject|attack,0.46833741664886475
,2012-05-17 13:42:34.7 UTC,90,10636885,read question secur onlin highscor list non-web game came conclus try encrypt secur score howev add kind feder login openid video game send score seem best websit mayb openid + oauth seem realli best access public api secur correct wrong point best solut consid want emb browser c++ game webkit etc exampl unity3d setup wait acquir licens websit want user anoth account manag googl twitter etc account mainli mean associ player score possibl store display name leaderboard thank,0.14444444444444443,13,c++ login oauth openid,use openid simpl leaderboard authent video game leaderboard,6,login|oauth|openid|authentication|security|encrypt,0.4629885256290436
secur breach trojan steal user credenti usual authent system save hashmd5/sha1 password password even one access hash cant steal password need password hash.i know window believ,2012-08-01 21:55:06.077 UTC,69,11768154,fairli basic question use libcurl find answer googling/stackoverflow libcurl authent user remot window site need pass window credenti domain/user/password libcurl retriev current login user credenti visual c++ purpose? goal prompt user window credenti,0.3188405797101449,22,c++ libcurl windows,window credenti ntlm / kerbero c++ libcurl,10,credential|kerberos|authentication|password|login|security|breach|trojan|steal|hash,0.4563871920108795
look http authentication?i fulli understand download process qt app basic/digest authent web server propag authent token easi safe.bas 64 base encod digest md5 hash lot librari implement step spring secur shiro java world saw two way server provid user uniqu link download instal packag server patch packag uniqu one-tim password client abl login first time browser collect inform user comput exampl ip mac os version etc calul digit sign comput base data c++ binari digit sign one-tim password main problem anyon execut program gain access user account suggest use one-tim login first authentif random token first start user/password inform ssl-connect delet one-tim login token replac actual login realli know whether ask precis code exampl want basic concept. anyway store login-data applic secur risk,2011-04-05 12:42:20.157 UTC,225,5551989,want following:a person regist onlin select login password desktop web applic login password applicationsthey download desktop applic written c++ qt cross platformthen login password automat pass desktop applic without person need enter data login password use authent server version desktop applic need individu code person login password base fact sign web page simpl explanation:1 user sign web site choos login\password2 user download desktop client computer3 user run desktop client c++ binari ask login/password step softwar fill login/password automat step 3 first time possible? done without secur risk,0.20444444444444446,46,c++ qt security,pass login password data web app desktop applic without caus secur risk,11,security|login|password|authentication|signing|safe|encode|md5|hash|user account|ssl,0.4557672441005707
syntax explain relat wikipedia articl https://en.wikipedia.org/wiki/basic_access_authent,2012-02-10 13:02:50.493 UTC,41,9228225,use socket winsock2.h connect ip camera.aft connect want send command /nphmotionjpeg?resolution=640x480&amp;quality=standard http/1.1\r\n\r\n video stream.but command success camera protect authent basic want insert request command usernam password know syntax,0.14634146341463414,6,c++ http,send http request authent basic,4,authentication|protect|username|password,0.4553004503250122
,2013-03-01 09:04:16.033 UTC,84,15154023,tri evalu password complex rule met use netvalidatepasswordpolici api.i found mani sampl one work tri differ way use api paramet result alway problem api test password length password short error 2245 mean password short enter longer password meet complex rule success code back instead anyon api function work? pleas help thank support code work tri two differ system one window 8 connect activ directori domain domain server domain run window server 2008 r2,0.14285714285714285,12,c# c++ complexity-theory passwords validation,netvalidatepasswordpolici evalu password complex rule length,2,password|validate,0.45230552554130554
click anyth need ifram anoth page script abl access ifram script access dom click button click probabl make parent page never attempt sure work think work,2013-07-26 17:02:45.693 UTC,77,17887063,tri creat javascript/html/or c++ automat press ok button window log onto ip via browser basic want automat log site cooki fill usernam password javascript automat press ok button pop separ log window without,0.12987012987012986,10,authentication auto c++ html javascript,creat script auto log onto websit access ip url includ click ok logon,5,authentication|scripting|cookie|username|password,0.4490325450897217
authent use credenti creat channel send audio config request audio send audio data request contain audio captur etc alsa sound api librari captur playback audio.and send receiv api request respons follow follow order doc servic name googl assist api embeddedassistant.googleapis.com object creation call look,2017-05-06 01:55:09.483 UTC,104,43815904,tri write c++ code creat googl assist udoo x86 board see https://developers.google.com/assistant/sdk/ .i tri follow step regard tutori sure url call creatchannel method? credenti json download use google_application_credenti environ variabl object creation contructor put google.com follow error:e0505 18:30:34.959710444 7635 ssl_transport_security.c:1226] invalid toplevel subdomain come0505 18:30:34.959836517 7635 ssl_transport_security.c:1226] invalid toplevel subdomain com,0.11538461538461539,12,c++ google-assistant-sdk,grpc creat channel link googl assist api,6,credential|ssl|transport|security|validate|authentication,0.44678065180778503
flag server side prevent client request server authent flag disabl requir peer authent request side case client request side flag server side,2017-06-02 07:52:43.423 UTC,96,44323601,server.pem server.jk back-end client soapui initi ssl server context order enabl simpl authent web servic follow troubl look wireshark send request soapui remot pc locat server decod look mutual authent go chang soap_ssl_default soap_ssl_no_authent sent request wireshark look simpl server authent go confus follow gsoap document tls/ssl option soap_ssl_no_authent disabl client server authent question wrong? thank advanc respons best regard,0.19791666666666666,19,authentication c++ gsoap ssl,initi server context use gsoap enabl simpl authent server authent,4,authentication|ssl|decode|tls,0.44551315903663635
rather void function password perhap return boolean valu true password enter correctli statement fals 3 attempt fail loop main function deal getpassword return need someth,2011-12-08 23:06:00.853 UTC,54,8439004,im tri write program limit password three incorrect attempt exit 3 incorrect attempt code thu far feel realli close figur cannot figur,0.12962962962962962,7,c++ login-attempts passwords,c++ password attempt limit,2,login|password,0.44389426708221436
account servic run under? specif domain user access ldap server? want spn ldap server well double-hop token problem authent,2010-01-07 16:57:13.923 UTC,117,2022033,"applic connect ldap server use ssl problem run consol applic connect success run applic window servic fail inform help ldap_sslinit allway return success 1 ldap_connect = 0 success ldap port run applic user administr test port 389,3268 without ssl 636,3269 ssl2 ldap_connect = 0 success run servic port 389 32683 ldap_connect = 81 connect run servic port 636 3269 test servic run user administr test special user agent permis enabl log servic permiss other without success ad certif local machin servic user exampl test result = ldap_server_down 0x51 appreci help give",0.1623931623931624,19,c++ ldap ssl,ldap ssl window servic,4,ldap|ssl|certificate|authentication,0.4391546845436096
qt seem handl authent automat signal/slot system separ header think handl authenticationrequiredqnetworkrepli * repli qauthent * authent signal networkmanag give fals posit authent request abl around reset authent signal sorri sure answer let know works! signal emit whenev final server request authent deliv request content slot connect signal fill credenti content determin inspect repli object authent object qnetworkaccessmanag cach credenti intern send valu server requir authent without emit authenticationrequir signal reject credenti signal emit note possibl queuedconnect connect signal connect fail authent fill new inform signal return see proxyauthenticationrequir,2015-11-05 11:57:47.247 UTC,155,33543959,"want remov author header request fire qt default add sampl request fire - https://mywebsiteurl.com/remote.php/webdav/3.txt http/1.1 author basic og== user-ag mozilla/5.0 linux myapp/1.2.1 connect keep-al accept-encod gzip deflat accept-languag en-us,* sampl code - result belowwith author header - https://mywebsiteurl.com/remote.php/webdav/3.txt http/1.1 user-ag mozilla/5.0 linux myapp/1.2.1 connect keep-al accept-encod gzip deflat accept-languag en-us,* api setheader,setrawhead avail complet remov header",0.2,31,c++ http-headers httprequest qt,remov author header http request qt,6,authorise|encode|availability|authentication|signing|credential,0.4372453987598419
time usernam aka attribut ad automat contain end comput account comput account actual password report comput updat password guess mayb made exampl sinc sound user account howev possibl explicitli put end user usernam want,2019-11-04 20:00:05,74,58700265,custom activ directori password filter dll two-domain dc window server 2012 r2 password filter sometim receiv usernam dollar sign user account name password filter dll report chang password happen,0.1891891891891892,14,active-directory c++ windows-server-2012-r2,usernam end $ activ directori password filter dll,4,username|password|signing|user account,0.4363110363483429
authent http request connect authenticationrequir signal slot name password field,2013-01-11 15:27:03.313 UTC,35,14281293,tri webkit display web page qml except find syntax access page contain login password snippet code thank,0.2,7,c++ qml qt qtwebkit webkit,authentif webview qml,4,authentication|login|password|signing,0.4357956051826477
document object exampl code qt design,2011-04-29 16:01:48.353 UTC,22,5834412,make suitabl enter password i.e show enter someth follw,0.18181818181818182,4,c++ passwords qlineedit qt,use qlineedit password,2,password|signing,0.4321056306362152
turn need se_restore_nam token privileg adjust process token follow add follow begin main exampl get rid 1307 error unfortun anoth bug exampl owner correct sid howev switch back backupread/backupwrit creat sid security_descriptor ponder issu luck perhap someon els answer part,2013-07-04 23:15:31.61 UTC,126,17479152,tri write backup recoveri tool run code winp cd http://en.wikipedia.org/wiki/windows_preinstallation_environ tri read entir c partit write network tar command window specif everyth work except set file owner window seem realli intoler file own unknown sid sinc run winp user defin c local user databas function tri setfilesecur return 1307 setsecurityinfo return 1307 setnamedsecurityinfo return 1307 backupwrit return 1307 ntsetsecurityobject return 0xc000005a know done setacl http://helgeklein.com/setacl/ abl question owner file non-exist user/sid? help greatli appreciated! sampl code tri,0.06349206349206349,8,c++ file-security winapi windows,file owner non-exist user/sid window,3,security|privilege|scripting,0.4302596151828766
sound want mutual authent want pc authent usb devic want usb devic authent pc well construct ssl handshak alreadi perform mutual client authent make sure everyon cert ca,2020-01-29 19:51:03,105,59974564,fluid monitor physic devicehardwar camera pcb board led light etc hardwar connect comput via usb cabl captur imag imag process c++ softwar pc secur featur alreadi implement node authent cryptoauth chip atecc608a inform want know method improv secur want make sure devic work laptop/pc provid alreadi implement pcb board ateccx608a cryptoauth chip store ssl certif verifi certif chainand random nonc challeng devic authent plea refer link https://www.digikey.com/eewiki/display/motley/atecc508a+node+authentication+example+walk-through,0.20952380952380953,22,c++ security ssl-certificate,suggest secur hardwar softwar imag process applic,7,security|ssl|certificate|authentication|crypt|oauth|nonce,0.4283234775066376
main issu see actual get cooki see reliabl ose / os version browser / browser version mayb includ encrypt resourc file download contain credenti put download archiv server side download without login realli option? edit includ one-us token download use client fetch usernam password via ssl encrypt somehow safe look good bet,2011-03-02 07:06:47.37 UTC,129,5164423,specif problem web base applic cooki login login detail use desktop applic connect web interfac idea possibl user login first web app cooki download applic instal pc start first time somehow user password auto fill login field desktop applic necessari write second time one way save login password plaintext cooki riski desktop app get cooki browser app written c++ realli clear idea moment done happi red suggest,0.16279069767441862,21,auto-populate c++ desktop php populate,cooki pre-popul inform desktop app,8,cookie|login|password|encrypt|credential|username|ssl|safe,0.4216708242893219
need access data use auth method credenti configur need provid custom header data client url work follow forget includ file,2017-11-29 15:24:12.477 UTC,120,47556223,problem access fantasi premier leagu data url https://fantasy.premierleague.com/drf/my-team/1447063/ url specif requir authent access use code answer basic http authent casablanca chang credenti base64 convers url u https://fantasy.premierleague.com uri l/drf/my-team/1447063/ dummi fantasi team safe publish userid password peopl try password anyth els output produc {detail:authent credenti provided.} http_respons result 403 forbidden suggest url access even credenti output suggest credenti found enter full url chrome alreadi log site json data want enter url edg log site output credenti provid flog dead hors access data? sure whether post comment origin answer anyway enough reput apolog duplic,0.125,15,authentication c++ casablanca rest,http authent casablanca,5,authentication|credential|safe|password|forge,0.4103538691997528
ok found problem read basic http authent scheme forgot author header modifi,2018-08-09 14:44:14.033 UTC,61,51769986,read document follow link https://github.com/reddit-archive/reddit/wiki/oauth2 tri retriev access token applic requir applic oauth sinc requir user insert credenti follow instruct page mention unabl retriev access token alway code registerd applic https://ssl.reddit.com/prefs/apps/ use instal type option,0.14754098360655737,9,c++ oauth-2.0 qt reddit rest,unabl retriev access token applic oauth use reddit api,6,oauth|credential|ssl|authentication|forge|authorise,0.4094584286212921
pleas see inlin comment data.txt,2015-12-08 12:20:25.403 UTC,21,34155748,done wrong? enter correct credenti program keep say invalid usernam password,0.19047619047619047,4,c++,doesnt read data file,4,credential|validate|username|password,0.40928369760513306
essenti foolproof determin user find find password way try make harder e.g obfusc etc see similar question md5 encrypt password one encrypt want check password correct creat md5 valu entr string compar string store databas actual password visibl refer link http://www.zedwood.com/article/cpp-md5-funct applic window credenti manag possibl someth similar linux https://stackoverflow.com/a/9228105/222748 anoth approach encrypt xml involv self-sign certif asymmetr encrypt work https://www.ibm.com/support/knowledgecenter/en/ss7jfu_8.5.5/com.ibm.websphere.express.doc/ae/cwbs_encryptv6.html gener mysql password databas look use crypto librari less easi predict random function base time,2014-07-19 10:17:51.677 UTC,154,24839251,work desktop applic login system written c++ start ask usernam password connect mysql databas verifi enter data current server password hardcod applic execut know bad practic ask opinion solv issu store server password encrypt decrypt everi time databas connect requir clever it? clarif mysql databas user root password root creat connect databas usernam password user want log enter usernam password noth root usernam databas usernam password store tabl creat,0.23376623376623376,36,c++ login mysql passwords,implement login system c++ mysql,10,login|password|username|encrypt|crypt|obfuscate|md5|credential|signing|certificate,0.4087054431438446
,2014-04-14 10:53:46.407 UTC,64,23058259,check user credenti window domain control user credenti given web gui nice pass raw password client server server side php c++ winapi anybodi idea pass user login/password safe call logonus way perform authent probabl use ntlm digest ?also need list group local global includ indirect log user membership modifi exist php extens option,0.140625,9,active-directory c++ ntlm php security,perform ntlm authent browser window domain,6,security|authentication|credential|password|login|safe,0.40687456727027893
