answers,creation_date,len,postid,question,ratio,raw,tags,title,uniq,words,probability
look known firefox bug open sinc 2001 bug 150605 - digest authent problem mozilla ignor nextnonc paramet authentication-info respons header duplic bug 116177 - next nonc digest auth test fail,2015-10-21 14:10:34.907 UTC,181,33261626,done c++ base http server rephras - spill anoth drop ocean encount issu http digest authent accord http authent rfc use direct header valid implement singl nonc mechan done accord rfc chrome firefox seem ignor direct issu request initi nonc thu trigger unneed 401 respons exampl illustr firefox first request - server return 401 issu initi nonc firefox success authent get repli header firefox issu new request fetch imag return html - still initi nonc use thu repli new nonc flag provid nonc expir sent back scenario first imag request authent succe new nonc authent succe second request well seen imag - even though repli upon success author first request next two request still origin nonc instead provid valu anyon similar experience? certainli someth wrong - even though rfc say client repli provid valu thu mandatori highli doubt popular browser techniqu,0.1270718232044199,23,c++ digest-authentication http-authentication,browser support nextnonc direct http digest authent,4,authentication|nonce|validate|authorise,0.9934608936309814
,2018-03-14 10:32:44.043 UTC,68,49275376,tri authent user programmat use win32 api c++ face issu user enter correct user name password incorrect domain loginus api return success expect case mismatch user name password domain loginus api must return failur incorrect expect develop pc domain i.e domain - > usernam = test correct password = abcdef correct domain = hardwar in-correct instead,0.14705882352941177,10,c++ winapi windows,loginus win32 api function return success even domain incorrect,5,login|authentication|user name|password|username,0.8835282325744629
,2018-10-16 12:08:09.463 UTC,38,52835123,want write code connect backend usernam password send usernam password connect ? code find clear explan implement author process code websit wanna login ask usernam password login button thank lot advanc help,0.23684210526315788,9,backend c++,connect backend use c+,4,username|password|authorise|login,0.864065945148468
statement ist true microsoft refer say chapter exchang servic localsystem account account password networkservic account correspond comput account local comput domain exchang servic run secur context localsystem account use local comput account credenti access domain resourc activ directori network log domain account,2013-01-07 06:51:01.35 UTC,84,14191213,comput join window domain log comput local account domain account fail kerbero credenti call acquirecredentialshandl possibl kerbero credenti local account? iis run nt authority\network servic account account local account iis kerbero credenti domain control,0.16666666666666666,14,c++ iis kerberos windows,kerbero credenti domain control,5,kerberos|credential|authorise|password|security,0.8101205825805664
,2019-04-03 08:57:16.393 UTC,24,55491049,unabl valid revoc ssl certif revoc server unavailable.sam request work rest user,0.16666666666666666,4,c++ https windows,httpsendrequestex method return error code 12057 particular domain user,4,validate|ssl|certificate|availability,0.7728144526481628
understand correctli look someth ftp winapi see url contain full descript exampl ftp connect client server username-password authent ftp authent process done command find detail,2012-02-28 15:42:42.887 UTC,55,9484998,written siml ftp client-serv code use winsock confus simpl username-password authent ? gone authent link given msdn made confus help appreci,0.2,11,authentication c++ ftp winapi windows,simpl ftp client authent,4,authentication|username|password|scripting,0.770710289478302
check devic time assum gener correct password digest problem devic differ time sign request password digest act expir,2012-05-29 11:24:56.327 UTC,61,10798187,write api c authent user use onvif write code make authent header sent header server respond secur token authent author sent request http use post method respons anyth wrong? especi creat digest? thank,0.14754098360655737,9,c c++ onvif soap xml,authent header work onvif request,5,authentication|security|authorise|password|signing,0.7566736936569214
decid give try turn solut simpl usernam contain domain name chang alreadi specifi domain separ paramet need part usernam abl still,2018-10-29 10:51:50.33 UTC,81,53043930,platform window 10 x64develop environ msvc 2017 activ directori platform window server 2016 evalu tri authent window user locat remot server maintain use window activ directori servic run local pc give invalid credenti error messag even pass proper authent user name password domain go wrong,0.13580246913580246,11,active-directory c c++ ldap winapi,user authent use ldap window activ directori window server 2016,7,ldap|authentication|validate|credential|user name|password|username,0.7543002963066101
connect sql server use user name password retriev user name / password without login sql server,2015-12-31 08:09:46.437 UTC,38,34543259,want connect c++ app sql server retriev inform usernam password know anyon help,0.18421052631578946,7,c++ connection-string sql-server,c++ blank app connect sql server,4,username|password|user name|login,0.7532560229301453
ldap_simple_bind_ credenti usernam password dn password.y need retriev dn ldap build usernam assum dns built ident,2016-01-10 19:52:48.023 UTC,44,34710082,applic use ldap authentif ldap_bind_ use return ldap_succ ldap_simple_bind_ return lap_invalid_credenti wrong credenti explain differ use ldap_simple_bind_ secur ? sampl applic use method,0.5,22,c++ ldap,ldap_simple_bind_ return ldap_invalid_credenti,7,ldap|validate|credential|authentication|security|username|password,0.7497665286064148
abl logonus api purpose. call fail either usernam password bogu,2011-01-05 04:20:31.373 UTC,60,4600783,given user name password check name valid user account system suppli password match password user account? edit need aris authent structur applic app use local account system allow user remot access file stuff app need authent user provid access servic,0.25,15,authentication c++ passwords winapi windows,verifi user name password window,6,authentication|password|user name|validate|user account|username,0.749590277671814
though note function return fals mean usernam invalid reason netusergetinfo succeed terribl ugli api,2015-09-16 09:18:24.66 UTC,74,32604425,tri valid whether given username/domain name enter user valid user machin i.e local user account exist user given machin requir activ directori user want user least log machin logonus api help valid username/domain name password combin tell username/domain name valid access password,0.24324324324324326,18,c++ msdn user-accounts validation windows,window c++ api valid window username/domain name valid account local machin without password,5,user-account|validate|username|password|user account,0.7169626355171204
alway rest api sign anonym user firebas id token database.to sign anonym https://firebase.google.com/docs/reference/rest/auth/#section-sign-in-anonym send authent request db https://firebase.google.com/docs/database/rest/auth#authenticate_with_an_id_token,2017-09-28 12:02:58.777 UTC,58,46468664,want firebas realtim databas cloud firestor desktop applic via rest api applic written c++ need user authent googl facebook login want secur databas need anonym authent best practic that? find inform regard,0.1724137931034483,10,c++ firebase firebase-authentication rest,firebas anonym rest auth,4,authentication|login|security|signing,0.7095686197280884
need header cooki second request must cooki return first request second send cooki must enabl cooki pars header pass function signatur pars block header follow http standard i.e find cooki header pass second request,2014-04-23 16:00:31.637 UTC,89,23249629,want write c++ program go log twitter alert new messag tweet found articl explain log websit libcurl https://www.hackthissite.org/articles/read/1078 use articl written simpl program download log page extract authent token put post request usernam password send problem instead log return log page log hackthissite.org log twitter use libcurl,0.1348314606741573,12,c++ http-post libcurl login twitter,log twitter libcurl,7,login|hack|authentication|username|password|cookie|signature,0.7004320025444031
,2016-12-06 12:28:56.253 UTC,36,40995460,"made web browser use qtwebkit site want enter without appli http://atla subvers repositori need usernam password prompt direct author say author firefox browser want user login follows,whi",0.1388888888888889,5,c++ qt qweb qwebkit qwebview,qt c++ qtwebkit applic,4,username|password|authorise|login,0.6724618077278137
ftp server repli invalid messag matter account password wrong prevent phish valid usernam function tell ftp server return ftp server secur code say wrong password noth function give differ result ftp server tell :-p ftp server distinguish invalid usernam invalid password naughti naughti sure function return server return case error 12013,2010-01-30 02:04:17.607 UTC,103,2166532,possibl duplic geterrormessag return &ldquo;wrong password&rdquo user name wrong? sinc geterrormessag g ave string invalid password usernam decid getlasterror separ error howev incorrect usernam still give code 12014? password error separ error code error_internet_incorrect_user_nam - 12013 work intend too? thank,0.1941747572815534,20,c c++ windows wininet,getlasterror getreturnmessag return “wrong password” user name wrong,6,password|user name|validate|username|phishing|security,0.6643914580345154
assum actual mean case behaviour exactli expect document flag say logon type allow caller clone current token specifi new credenti outbound connect new logon session local identifi use differ credenti network connect local connect token return clone current token credenti provid use outbound connect attempt connect credenti check point expect failur,2016-02-11 11:54:22.717 UTC,80,35338656,bret alway return true even enter wrong password domain work around enter valid password return true fals wrong password domain,0.125,10,c++ impersonation login winapi,logonus return true wrong password,4,login|password|validate|credential,0.6595048308372498
prepar 2 queri execut one password match log work best / safest check credenti,2017-04-29 19:07:15.977 UTC,37,43699490,creat app requir log user problem even user enter usernam password code get execut log correctli,0.16216216216216217,6,c++ qt sqlite,qt sqlite login applic,5,login|username|password|safe|credential,0.6260036826133728
,2015-04-16 07:58:58.927 UTC,78,29668696,work qt applic authent local server run spring-mvc base webapp tri authent via curl work help got code authent via qt webapp problem send post request webapp usernam alway empti know tri use urlencod seem effect anyon tell go wrong? qt code output code debug log spring webapp pleas note last line debug log updat problem solv edit post anyon want authent spring-secur feel free code,0.1282051282051282,10,authentication c++ curl qt spring,qt qnetworkrequest send blank usernam remot authent,4,authentication|username|encode|security,0.6256670951843262
someon work provid answer,2015-12-01 14:52:41.643 UTC,61,34023278,accord msdn requir specifi exact usernam password current user credentials? without need specifi usernam password send request respons server iis use ntlm window authent tri follow msdn exampl exampl requir given usernam password edit make thing clearer current use code similar appear winhttp request c,0.16393442622950818,10,authentication c++ http iis winhttp,send winhttp request use current user credenti,4,authentication|credential|username|password,0.6037011742591858
call paramet 1003,2013-01-08 13:06:03.757 UTC,48,14215626,write c++ program manag user account window 7 password exist user account cannot netuserchangepassword netapi32.dl sinc record previou password creat user program must abl new password without know old password programmat c++? thank help,0.22916666666666666,11,c++ passwords windows,user account password without know old password c,2,password|user account,0.597038209438324
,2019-03-22 17:04:02.087 UTC,110,55304557,"want qtnetworkauthor grant access resourc rest apis.th server want connect use oauth1.ther exampl qt network author use old interfac qoauth exampl offici sdk show exampl twitter requir gui applic qdesktopservic twitter automat grant access user allow access want requir 3 step 1 use request_token queri clientid clientsecret temporari credenti 2 use clientid,clientsecret temptoken,tempsecret ask user open constentdata url verifi code shown user user copi 3use verifier,clientid temporari credenti app request perman credentials.so far use qoauth1 code piec code abl temporari credenti pass second step ask user verifier.ther method implement protect function setverifi qoauth1 access qoauth1 pass three step authent",0.14545454545454545,16,c++ qnetworkaccessmanager qnetworkrequest qt qt5,make 3-leg oauth1 authorizaion request qoauth1,5,oauth|authorise|credential|protect|authentication,0.5928701758384705
,2018-12-08 10:47:00.093 UTC,38,53681750,it´ goal code two factor authent window work window 10 window 7 want know it´ possibl code one c++ program languag basic want know edit window login window,0.21052631578947367,8,authentication c++ two-factor-authentication windows,code two factor authent window c+,4,authentication|two-factor|two factor|login,0.5812086462974548
,2014-07-08 12:48:28.423 UTC,65,24632303,program authent peopl current machin run identifi user ldap server succes test code simpl comput work ldap one say authentif failur therefor tri think ldap issu howev got error tri log look server found cannot authent question differ pam ldap pam gener authentif someont ? achiev authentif ldap pam program wrong ldap test code,0.24615384615384617,16,authentication c++ ldap pam security,authentifi user c++ program ldap pam,3,authentication|ldap|security,0.5799091458320618
,2017-03-21 14:16:48.543 UTC,46,42929676,hard time connect mysql ssh. ssh tunnel seem setup correctly.th mysql credenti correct.i grant permiss user.and given access % remot server anyon know accept login mysql databas ? cannot seem figur wrong :- code output,0.17391304347826086,8,c++ mysql ssh,remot mysql login ssh error 1045 use c,4,ssh|login|tunnelling|credential,0.5741747617721558
think pipe proper commun service.and use window credenti manag save/load password effect differ logon session user sid disabl log yet,2015-03-03 07:43:28.99 UTC,108,28826510,written custom window credenti provid captur user login one main purpos provid store password user c# servic run window log lead problem store credenti inform time login i.e user provid valid login inform choos login servic abl fetch inform proper commun credenti inform service? part login user credenti less accord provid microsoft sampl credenti provid getseri look edit tri window credenti manag api save password seem effect try fetch usernam / password aft log noth return,0.21296296296296297,23,c++ com credential-providers password-protection windows,provid credenti inform credenti provid c# servic,6,credential|password|protect|login|validate|username,0.5684923529624939
"think need sort http authent either basic digest try basic authent first send addit header request construct string username:password encod use base64 look link wikipedia articl inform http authent resolv part author request.setheaderauthorization,bas + base64.encodetostr user:password.getbyt base64.no_wrap request httpget instanc",2012-02-22 14:15:55.55 UTC,97,9396523,encount problem work ip camera panason bl-c111ce want motion jpeg stream camera follow step command work fine enabl privileg view video gener user camera set disabl privileg command fail search knew need send admin usernam password order authent camera know syntax send usernam password step must send it? mani thank phong le,0.18556701030927836,18,c++ ip-camera,authent ip camera,6,authentication|privilege|username|password|encode|authorise,0.568315327167511
similar problem two thing run/instal win32 openssl installation.download latest light win32 win64 instal packag exampl win32 openssl v0.9.8l light follow link http://developer.nokia.com/community/discussion/showthread.php/234276-qt-ssl-handshake-fail,2014-02-18 19:23:34.97 UTC,99,21863409,tri c++ app access php script differ comput script queri mysql databas output valu access web browser give site secur certif trusted! page allow proceed anyway expect ok yet jump hoop certif certifi howev try access site within c++ app use qnetworkaccessmanag tell quit problem? someth fact certif authent someth else? featur qt creator allow code access even trust sites? guidanc help thank advanc,0.15151515151515152,15,c++ https php qt ssl,ssl handshak fail tri run http code c,7,ssl|scripting|security|certificate|trust|authentication|openssl,0.5666689872741699
probabl see http://msdn.microsoft.com/en-us/library/aa375178.aspx old see http://msdn.microsoft.com/en-us/library/aa375177.aspx solv problem? updat anoth old authent user use sspi help display dialog implement find old code exampl probabl first one publish microsoft http://support.microsoft.com/kb/180548 want ldap api see http://msdn.microsoft.com/en-us/library/aa366102.aspx see http://msdn.microsoft.com/en-us/library/aa366156.aspx verifi user authent see http://msdn.microsoft.com/en-us/library/aa366106.aspx code exampl exactli want understand api work,2010-07-08 17:56:17.927 UTC,78,3206526,current tri authent user c++ applic window need display dialog usernam password verifi authent user window machin librari allow function good go,0.14102564102564102,11,authentication c++ ldap windows,window ldap authent c,4,authentication|ldap|username|password,0.5630170702934265
,2015-08-07 14:45:00.853 UTC,67,31880563,tri nativ send basic authent request server anyon exampl accomplish this? edit far tri encod usernam password base 64 string exampl encod base 64 return string creat new string prepend basic encod string connect server use pass success try pass encod string made server use sure exactli wrong alway return error code 12150 error_http_header_not_found,0.14925373134328357,10,authentication basic-authentication c++ http wininet,make request use http basic authent nativ c+,4,authentication|encode|username|password,0.559532880783081
tri tri put url? someth curiou know work current use free timestamp server never know see tag post rfc 3161 mean cryptretrievetimestamp work rfc 3161 timestamp servers? document marvel unclear go try soon chanc alway worth ask,2017-01-23 14:34:04.907 UTC,78,41808771,tri retriev timestamp tsa use cryptretrievetimestamp free servic found answer alway use flag want paid servic use credenti cannot figur use usernam password anyon know send usernam password tsa use cryptretrievetimestamp,0.16666666666666666,13,c c++ rfc3161 trusted-timestamp wincrypt,pass usernam password cryptretrievetimestamp function,5,trust|crypt|username|password|credential,0.5579771995544434
solv issu compar sid rather usernam domain sid retriev use lookupaccountnam usernam domain current lock user queri wtsusernam wtsdomainnam wtsquerysessioninform exampl code microsoft help loop credenti provid user icredentialprovidersetuserarray::setuserarray function detect one current lock user thank @swift point solut,2017-01-05 10:09:11.493 UTC,213,41482189,develop window 10 credenti provid act unlock scenario current sign user describ start window 10 cpus_logon cpus_unlock_workst user scenario combin credenti provid need enumer current user log system keep track current user leverag api wtsquerysessioninform obtain inform use wtsquerysessioninform usernam current log user wtsusernam login system call icredentialprovidersetuserarray::setuserarray initi login ui retriev user show ui credenti provid user icredentialproviderus retriev icredentialprovideruserarray interfac user queri usernam queri string valu pkey_identity_usernam compar usernam wtsquerysessioninform one return pkey_identity_usernam allow know user last current lock user multipl account pkey_identity_logonstatusstr lock work well local account sign microsoft account one sign microsoft account usernam return wtsquerysessioninform differ one given pkey_identity_usernam user sign my_user_microsoft@myemail.com got follow mismatch use wtsquerysessioninform usernam current lock user usernam my_u one return pkey_identity_usernam well usernam my_user_microsoft@myemail.com qualifi usernam microsoftaccount\my_user_microsoft@myemail.com usernam return wtsquerysessioninform truncat report full email address thu allow compar usernam enumer user idea usernam crop way? full usernam use wtsquerysessioninformation?thi behaviour test freshli creat microsoft account,0.17370892018779344,37,c++ credential-providers unlock winapi windows,issu get usernam current lock session microsoft account vs local window 10 credenti provid,4,credential|username|signing|login,0.5553677678108215
call lsacallauthenticationpackag messag type kerbqueryticketcachemessag run return kerb_query_tkt_cache_respons tickets[index].endtim compar current time refer endtim timestamp,2010-02-25 12:47:30.777 UTC,48,2334024,client side applic use kerbero authent connect remot servic reset password spn adsi without renew ticket authent fail course.th question know advanc ticket valid\ expir,0.1875,9,authentication c++ kerberos winapi,know kerbero ticket expir,4,authentication|kerberos|password|validate,0.5483590960502625
gener random token save databas timestamp definit easiest solut fail anoth commun process gener sign token server valid web app server creat token encrypt data authent encrypt method gcm base-64 encod append url web app decrypt valid data timestamp ok log user requir share key process must lose,2015-01-12 23:13:49.263 UTC,146,27912388,tri asp .net websit c# game server game written c++ game server host web site want user abl automat login websit click button game game make request game server token gener use log websit server sendback someth awar easi solut creat token databas web site read cannot find better solut ideal gener token wherebi next 5 minut pass token userid login user pass password simpl idea hash password hash usernam work timestamp anyon suggest this? mysql gener token validated? use mysql mind solut use databas want solut write databas thank,0.11643835616438356,17,asp.net c# c++ mysql,token login c++ c,10,login|password|hash|username|validate|signing|encrypt|crypt|authentication|encode,0.5475689172744751
,2019-12-02 19:34:48,43,59145557,case user log desktop aapln connect server server return token get use request get refresh requir tri oauth workflow.for need feel grant type resourv owner password credenti anybodi help minim exampl it?also pointer concept help,0.16279069767441862,7,c++ c++11 oauth qt,qoauth authent user login,5,oauth|authentication|login|password|credential,0.5455229878425598
final got authent complet correct server demand cooki appar one must show cooki repons explain firefox browser authent correctli curl lwp-request albeit stick standard - rfc said noth cooki standard noon care for? anyway append header solv problem,2014-09-08 21:59:02.957 UTC,137,25733760,try write c++-applic http digest authent problem primarili c++ fact connect establish websit try access follow httpbin.org/digest-auth/auth/user/passwd consid follow server respons simpl comput hash refer ha1 comput hash refer ha2 inform respons comput valu comput nonc taken server respons total hash combin inform suffici establish http-connect use digest authent howev follow request declin server answer anoth note format show structur request block author opaqu actual one line feel free re-do md5-calcul - redon calcul manual got hash program use tool http://md5-hash-online.waraxe.us/ manual comput miss someth obviou probabl misinterpret standard way? author,0.145985401459854,20,authentication c++ digest digest-authentication http-digest,digest authent right,6,authentication|hash|nonce|authorise|md5|cookie,0.54501873254776
simpl web authent done use fine safe simpl reason need re-impl function use fast easi,2010-07-29 15:04:38.757 UTC,79,3363943,work old atl ocx use download manager.it download file use urldownloadtofil api previous host activex web page case server requir authent done ie part execut take care authentication.let say user provid usernam password actual authent ? need support simpl web authent ntlm iis simpl web authent found pass username/password url work fine sure proper pleas advisethank youzaki,0.16455696202531644,13,authentication c++ download ntlm urlmon,urldownloadtofil authent,4,authentication|username|password|safe,0.5436537265777588
,2018-09-17 07:26:12.657 UTC,54,52362713,use wxwebview display loginpag app window url use show follow error imag get error = code server self sign certif get error someon pleas help handl error continu login page app ? use default backend engin given document https://docs.wxwidgets.org/3.1/classwx_web_view.html give handl error,0.14814814814814814,8,c++ certificate ssl-certificate wxwidgets,ignor secur websit error proceed wxwidget use wxwebview,5,certificate|ssl|security|login|signing,0.5434175729751587
,2013-08-06 09:53:59.343 UTC,35,18076893,winhttpcrackurl api fail 87invalid param win7 os pleas one suggest solut decod url easi server side ?.also want know distinguish %20 encod url actual data present url exampl localhost:8080\server\search?value=value%20,0.14285714285714285,5,c++ http,winhttpcrackurl fail 87 error,4,crack|validate|decode|encode,0.541735827922821
