answers,creation_date,len,postid,question,ratio,raw,tags,title,uniq,words,probability
yes intend typic ftp server distinguish invalid password invalid usernam secur reason e.g attack brute forc discov valid usernam,2010-01-29 23:52:57.847 UTC,60,2166098,geterrormessag cinternetexcept give follow incorrect ftp server name error! server name address resolv incorrect password error! password allow incorrect user name error! password allow &lt;-----? separ messag incorrect username? intend,0.25,15,c++ winapi windows wininet,geterrormessag return wrong password user name wrong,6,password|user name|username|validate|security|attack,0.5319907665252686
,2016-11-03 20:30:30.303 UTC,119,40410710,"need connect ad lds instanc use starttl list user unfortun done legaci c++ app.i instal test ad lds window 2008 r2 machin run network servic look ssl correctli access use simpl auth + starttl client machin use apach directori studio ldap admin code c++ call https://msdn.microsoft.com/en-us/library/aa772238v=vs.85.aspx szpath ldap://ip:10386/cn=users,dc=product,dc=loc strusernam cn=admin,cn=users,dc=product,dc=loc m_authent ads_authentication_enum https://msdn.microsoft.com/en-us/library/aa772247%28v=vs.85%29.aspx?f=255&amp;mspperror=-2147217396 tri differ combin ads_secure_authent ads_use_encrypt ads_use_ssl work accord microsoft exampl far ads_use_encrypt ads_use_ssl give promis error ads_secure_authent + ads_use_ssl + ads_use_encrypt give server log give 2 fail auth events:th comput attempt valid credenti account tri authent user vs local machin vs global ad test ad lds forc authent user vs test ad lds",0.18487394957983194,22,adam adlds c++ ldap ssl,access ad lds adam use adsi c++ starttl,8,ldap|ssl|username|authentication|security|encrypt|validate|credential,0.5262208580970764
pleas pay attent exampl document proxi authent challeng respond reset credenti proxi requir re-authent respond still work need instead proxi authent exampl,2018-11-16 11:54:44.973 UTC,70,53337387,code return valu 407 username-password proxi server use provid usernam password still return valu 407 proxi server isnot username-password code work per requir i.e return valu 200 case authent code fail use sampl pleas guid proper solut,0.17142857142857143,12,c++ visual-c++ winapi windows winhttp,case proxi server winhttp authent fail,4,authentication|username|password|credential,0.5252636671066284
realli right perform password check ldap attempt bind use obtain first search password suppli i.e perform second bind verifi password bind fail password incorrect someth akin secur reason indic usernam incorrect i.e search user account fail gener consid excess disclosur avoid,2013-04-23 11:32:54.36 UTC,98,16168293,write client app use openldap librari user get authent via ldap server sampl hard code program fail compar userpassword user userpassword plain ldap server work password md5 encrypt ldap_compare_ fail pass cleartext password compar sampl program working? right? correct authent user via ldap? p.s first time work ldap,0.2857142857142857,28,c++ ldap linux openldap,password authent user use ldap,9,ldap|password|authentication|md5|encrypt|security|username|user account|disclosure,0.5228337049484253
,2019-09-17 15:52:11,67,57977916,tri send http request devic network requir credentials.for exampl webbrows request work http://mylogin:mypassword@10.11.2.118/axis-cgi/virtualinput/activate.cgi?schemaversion=1&amp;port=1 howev figur put login password inform use boost beast creat request field request use? update:i found follow librari support basic digest authent use boost beast https://github.com/ravenger/simple-beast-cli use librari perform request url complic though update:i switch use libcurl handl authent put url suppli directli allow digest authent,0.14925373134328357,10,boost-beast c++ http,boost beast suppli login credenti,4,login|credential|password|authentication,0.52198725938797
understand requir correctli fire queri credenti tabl evalu result count 0 password user id wrong greater 0 ideal equal 1 credenti valid see follow work call alreadi call valu next call return figur problem function chang problem solved.thank,2016-11-03 15:41:26.927 UTC,65,40405732,new sqlite pleas help usernam password pass argument alreadi store password correspond usernam tabl name credenti check password valid?thank,0.2153846153846154,14,c++ sqlite,authent user valid password sqlite c,5,authentication|validate|password|username|credential,0.521629273891449
ntlm/kerberos/negoti sspi exchang loop full sampl msdn client server clear sort ldap access explictili lsa local secur author talk ldap establish ident client succes entir sspi loop authent succeed alreadi client ident alread authent ldap server need know client ident eg know rname retriev secur context result sspi loop use retriev user name structur,2009-08-26 22:35:08.013 UTC,174,1337923,ask provid support authent user activ directori exist client server applic moment user suppli user name password client machin pass wire encrypt server process match user name/password store databas initi thought easi problem solv sinc simpli authent user name/password activ directori server process howev turn user enter password client applic instead take credenti current window login session face problem authent use activ directori without password? sure must somehow pass sort token client server process use altern authent method research far drawn blank server written c++ use win32 api intend develop debug use virtual machin run window 2008 ad lds - hope suffici tri achiev help advic much appreci,0.16091954022988506,28,active-directory authentication c++ ldap winapi,authent user use activ directori client-serv applic,10,authentication|ldap|user name|password|encrypt|credential|login|kerberos|security|authorise,0.5153875350952148
,2017-12-03 17:05:30.663 UTC,73,47620909,write window 10 applic c++ option display sensit inform screen user click display button enter password continu rather write password manag system hope simpli user enter window password window authent allow peopl comput base program function without worri click display button back turn window sdk call allow request window forc user enter password even enter administr mode continue? tri someth know caus window authent,0.1232876712328767,9,c++ passwords windows,authent window 10 user continu c,3,password|authentication|sensitive information,0.5127609968185425
easiest observ fact run login session current user know password window handl authoris automat start .there determin password user api authent user base password give logon window keep password api succe - breach safeti ask user credenti,2016-06-16 06:59:50.003 UTC,79,37851983,user system account? want make authoris prog window account tri activ directori help name inform passwords? understand password free access need compar input string real user window password? emb authoris program window user account,0.24050632911392406,19,c++ passwords user-accounts windows,window full user account,9,password|user-account|user account|authorise|login|authentication|breach|safe|credential,0.5120790600776672
know equival c# c use function note requir alreadi connect comput comput configur authent i.e simpl file share turn need specifi local name connect,2012-01-25 20:58:42.217 UTC,80,9010198,machin machinea wifi lan network tri authent user usernam testusernam password testpassword machin machineb wifi network domain control network want valid credenti regular machin visibl network solut suggest c# open suggest languag fork differ process return valu differ languag possibl pleas explain well,0.125,10,.net c c# c++,valid window user credenti differ machin wifi lan network,5,validate|credential|authentication|username|password,0.5116273164749146
,2019-12-06 17:58:35,105,59218147,tri winhttp librari basic authent use user name password special char £ fail reach server as-i get translat \xa3 exampl password test£pass reach server test\xa3pass fail valid postman app fail similar abl bypass postman limit manual encod basic auth base64 string shown call succe tri workaround winhttp librari use pass author string manual rather use pass usernam password issu face work around user type wrong usernam / password 401 server use easi overwrit credenti manual authorazi header use remov header add new author header? suggest welcome! pass base64 authent string use cleaner fix problem thank advanc,0.18095238095238095,19,base64 basic-authentication c++ winhttp,pass base64 user credenti winhttpsetcredenti,9,authentication|credential|user name|password|validate|bypass|encode|authorise|username,0.5061405301094055
,2019-04-22 20:01:00.023 UTC,78,55800385,"run load test keep send request googl text-to-speech notic client receiv bunch error code 16 unauthent hourli basi error last one minut everyth back normal correspondingli see grpc log i0418 15:56:42.058182865 4182 call.cc:777] 1 {created:@1555617402.058118998,description:error receiv peer,file:src/core/lib/surface/call.cc,file_line:1099,grpc_message:request invalid authent credenti expect oauth 2 access token login cooki valid authent credenti see https://developers.google.com/identity/sign-in/web/devconsole-project .,grpc_status:16} i0418 15:56:42.058221929 4182 completion_queue.cc:691] cq_end_op_for_nextcq=0x1fa9a480 tag=0x1fa96948 error=no error done=0x7fba193e52a0 done_arg=0x1fa96a90 storage=0x1fa96a98 use grpc::googledefaultcredenti",0.1794871794871795,14,c++ google-text-to-speech linux,reciev error code 16 unauthent googl text-to-speech hourli basi,8,authentication|scripting|validate|credential|oauth|login|cookie|signing,0.5044125914573669
basic authent problem qt librari need compil openssl support two help answer 1 openssl qt c++ 2 qsslsocket error ssl use,2017-05-08 09:21:07.77 UTC,83,43844013,tri retriev data tagnifi use basic http authent unabl complet request accord tagnifi doc authent key suppos pass usernam queri url ignor password tri follow work expect omit password semicolon http basic authent format i.e tri follow semi-colon tagnifi doc exampl say url follow basic authent warn qt follow wrong? pleas advic,0.1686746987951807,14,basic-authentication c++ https qt,http basic authent tagnifi fail qt,5,authentication|username|password|openssl|ssl,0.5010696053504944
,2015-12-06 21:26:24.847 UTC,51,34122985,tri make user registr type program want user regist enter login password confirm password done choos option main menu user login valid detail login password far thing two function reason type password login even password match program give incorrect password messag,0.27450980392156865,14,c++ passwords registration while-loop,login inform password confirm work c,3,password|login|validate,0.5004490613937378
mean domain domain trust w/ domain run code fail design sever year ago microsoft best answer use support ticket wnetuseconnect old peac code abl test given,2011-05-16 14:46:07.15 UTC,149,6019094,need valid user/password pair nativ c++ windows.input user password user domain\us format basic need write function that:if user/password valid local account return true part 1if user/password valid domain given return true part 2els return fals use kb180548 solv part 1 check user name valid user fail user blank password - ugli workaround work howev domain besid kb sampl code worksincorrectli user/pass pair tri use ldap_bind_ succe incorrect user/pass pairsth dread guest account? domain fail valid user/password ldap_server_down mayb local host domain controller? mayb notion unclear hope least problem explain clearly.i stuck method log implement c++ nativ code question c# valid domain credentials? seem figur except accept answer ala c# edit come stack overflow never let,0.14093959731543623,21,active-directory authentication c++ windows,valid domain user credenti,8,authentication|validate|credential|password|user name|ldap|trust|signing,0.4996379613876343
,2014-12-10 21:42:54.53 UTC,95,27411379,tri construct applic allow user reset domain password access box domain corp network e.g user domain user travel network forget password cours login use domain cred cach local hkey_local_machine\security\cach unless cours forgotten password alreadi creat login shell addit take user web 2.0 style secur question etc verifi ident howev last step actual updat local secur cach new password user continu login resync domain control elud look api credwritedomaincredenti credwrit etc etc seem offici anyon idea write new hash local store essenti simul valid domain logon cach write event,0.17894736842105263,17,c++ security windows,problemat hkey_local_machine\security\cach valu domain,7,security|password|forge|login|credential|hash|validate,0.49881383776664734
,2014-02-05 12:27:44.867 UTC,25,21577294,anyon pleas suggest encrypt login credenti jqueri client side decrypt c++ server side hash mechan thank,0.44,11,c++ jquery password-encryption,encrypt login credenti jqueri decrypt c,6,password|encrypt|crypt|login|credential|hash,0.4967503249645233
familiar particular api look function request header call setrequesthead tri ad follow line directli request header? author basic %s\r\n note %s name:password base64 encod,2009-07-17 19:15:29.3 UTC,76,1145164,window api call allow download web resourc specif xml document site protect use digest authent without enter usernam password? msxml “open” function interfac requir usernam password suppli even though log window domain server internet explor accomplish task without requir enter inform,0.14473684210526316,11,c c++ http-authentication winapi windows,download web resourc use digest authent,6,authentication|protect|username|password|authorise|encode,0.4918995201587677
test mind bend turn issu noth digest authent need send cooki fake=fake_valu httpbin.org server modifi version sampl work note addit call setcooki creat httprequest path need suppli entir uri,2015-03-18 09:45:05.14 UTC,92,29118669,use poco servic client client login digest authent poco document claim digest authent support util class work http authent basic digest httprequest object full sourc test gtest show problem test fail statu http_ok expect get 401 http_unauthor earlier check fail chang uri site basic authent everyth work expect test pass wrong? bug poco? fix somehow,0.11956521739130435,11,c++ digest-authentication http poco-libraries,client digest authent poco,4,authentication|login|authorise|cookie,0.49040719866752625
"respons summar chat made comment section one player host game cheater host ? cheater host mean run server code impli influenc entir game oper core engin good solut player comput checksum compar player checksum engag one game one checksum match game cancel checksum uniqu string base one program version host hack system ? player comparison player hack game highli unlik @olavi mustanoja point checksum system great synergi updat client edit op origin idea compar game state turn player state game store int array 0 mean avail space -1 mean piec snake -2 mean head snake 8 mean appl cooki turn game compar state-array termin game point state differ other easili done send hashcod array idea incompat checksum idea doubl secur main problem server game state need trust client case modifi sinc client allow whatev take determin next step mean realli trust server execut remot machin manipul checksum digit signatur sinc machin itselv trust think 3 thing make server trust execut server one machin control -> game client connect server imho best solut problem host server usera userb userc use server play usera userd play server host @ userb one interest hacking/modifi client/serv code => difficult implement need server infrastructur game lobby.. client local server two combat agre result game count => detect someon someth bad exactli make counter server one user often manipul match exclud result lot depend intend limit okay algorithm ask user input? suppos limit inform algorithm access to? use java/c++ code give algorithm abil almost anyth setup window choos path snake follow allow oper human intellig machin precis give option swap differ algorithm activ escap mode sticki situat attack mode specif attempt trap player notic bad spot someth want avoid recomend provid script languag lua javascript easili custom limit capabl prevent user access anyth want decent well actual safe send script clients/serv safe run simul compar steps/result okay thing concern involv host use hack client alreadi mention player cheat player cheat easi method cheat? 1 chang state game effect undo previou move player and/or server valid updat sinc discreet valu deal problem client side check enough sharp hacker hack check chang check thing bool allowedmov { return true . remain origin check code here} must counter checksum code sha3? md5 near end safe epoch exampl wow teleport hack x,y,z calcul client send host cheater hack client desir result bliz make checksum client cheater insert new network packag x,y,z teleport wish bliz check extern program cheater random extern program bliz counter server side distanc check cheater counter limit teleport distanc allow result peopl walk air fli bliz counter server side saniti check appar solv problem 2 react inhuman speed effect elimin human delay.not problem game unless faster give move program . alway faster human reaction time often faster human possibl cheater properli end differ repli ping time larg enough 3 automat target ensur inhuman high hit rate player much better hit rate 2nd best confirm human player exampl shooter game xxx extern program catch player coordin feed correct target game via window api 4 use extern helper program much better ai player exampl onlin chess game cheater use chess program help move player make program save game state make extern program process data make next move load cheater program send next move check load program player legitim want save analys program effect use optim multi-chip multi-thread vector algorithm cheater explor game state nearli imposs check extern program help check extern window event gener lot fals posit try prevent load/sav cheat cheater attack ip-level biggest protect effort make outweigh benefit 5 multi-box player multipl comput cooper victori use multipl comput instanc program increas chanc cheater main instanc win sabotag player exampl happen shooter game? cheater send decoy suppress unit draw fire hinder enemi movement real player shoot oppos player score point way difficult check 2 person legitim play locat mac address comput multipl player indic cheat pli pc even cheater play close virtual machin 6 pre-comput game state cheater optim strategi player chose suboptim start move exampl tic-tac-to possibl calcul game state possibl head tic-tac-to rate player help cheater still easili win pre-compil open sequenc usual chess program exampl beat random map start posit larg state cannot pre-calcul 7 creat new ident beat rate cheater trill win creat new player low rate win happen even player cheat creat new ident beat easi victim 8 win trade 2 cheater trade win exampl wow battleground use extern program increas chanc get right oppon disconnect avoid regist pair right oppon disconnect often happen even without cheat play wireless mobil want reduc detect 2 mac-address play lot differ ident one mac win 9 disconnect lose x unknown unknown oppos known known unknown known known unknown alway someon invent new way cheat think exampl tax evas alway loop hole miss fals report incom new deduct fraudul etc luckili alway find someon cheat top posit check algorithm submit program see cheat bewar program retriev fake test much trivial smarter cheater stay bit radar",2014-10-23 04:47:53.217 UTC,1348,26521477,tag tag java c++ question mean look language-specif answer tag c++ java profici like understand code-sampl written similar languag look for? pointer insight secur measur take consider develop softwar mainli game one describ secur mean check doubl check user act intend mean behaviour send his/her updat collect malici virus exist server/oth client otherwis compromis user-experi player exampl hack expect comment answer ask stop peopl hack game? mean question broad thread howev come across simpl win everi game cheat pleas tell question better suit x ask question codereview programm network post badli receiv badli receiv well fair refer comment adtc henc bounti place bounti rewritten post better meet standard howev still think post suit well pleas tell hard time determin realli better suit programm think dump post think second creat connect two machin socket googl look kind technic help know implement softwar first time pleas look actual question ask ask this? softwar question develop snake-lik multiplay game player algorithm determin next move snake player connect client-serv connect one player act host assum server code wait player made turn updat game-st client game game search folder compat .jar file whose main class extend particular abstract class player connect anoth player network directli connect search game lobbi play player algorithm determin next move snake durat game vari lot depend updat rate specifi game time fast like end less 30 second far yet implement actual network multiplay templat sourc file logic follow plan host player perspect next move player network string format left right secur issu front actual program client use determin next move ever run respect client comput hope follow far anyway concern right pothol overlook determin pothol bit tediou task wont ask primarili give insight matter expect ideal bigger pictur multipl answer differ peopl question float top other prevent client use method program compromis user experi player ? method exampl pretti annoy player made algorithm wait 10 minut move particular problem figur time limit move lagging/malici player kick assign default move game continu normal off-not @darinth answer remind import aspect game user input allow mean next move snake determin human player - game play normal keyboard addit noth restrict choos pure ai keyboard-only-solut mix togeth exampl control snake let ai take notic drive trap wrap overlook someth big? plan small project friend kill time bit enthusiast pleas answer without hesit matter small idea later edit answer comprehens think point interest check answer edit regularli thank time relev idea receiv answer compar hash game-st client everi move player hash kick minimum requir host kept game 4 player 2 player one hash 2 player anoth hash group includ host kick etc came one howev thank @toyono credit goe game start compar checksum player player differ checksum host kick even let game credit goe @toyono random rank match prevent effect use multipl connect machin play game one player play multipl snake one game one algorithm tri play game legitli two algorithm simpli sabotag player credit goe @surt user input allow design part game start forgot mention credit @darinth come possibl thu remind import aspect,0.04228486646884273,57,c++ java multiplayer networking security,pothol autom multiplay game player algorithm,20,security|malicious|virus|hack|signing|hash|checksum|forge|availability|cookie|trust|signature|attack|scripting|safe|validate|md5|sanitise|protect|fraud,0.4888714551925659
pass requir usernam password libcurl done via option curlopt_userpwd follow,2012-05-04 11:34:23.593 UTC,33,10448035,tri upload file use libcurl appear authent connect server tri use avail code,0.15151515151515152,5,c c++ codeblocks ftp libcurl,authent libcurl ftp download c,4,authentication|availability|username|password,0.48797526955604553
,2017-03-24 21:13:37.403 UTC,51,43009237,want request certif ca know creat csr https://msdn.microsoft.com/en-us/library/windows/desktop/aa382364v=vs.85.aspx send assum server respond certif join two certif one? ie user even know open ie window 10 besid root certif must instal well creat local applic check certif enrol api know setup php app compat,0.1568627450980392,8,c++ cryptography ssl winapi,crypto api csr process,3,crypt|ssl|certificate,0.4824274480342865
adsgetobject function - want bind current credenti - check user authent specif domain simpl check environ variabl user workgroup domain evid user loge server differ getusernameex api job,2011-10-05 15:03:32.173 UTC,129,7663439,possibl duplic authent user use activ directori client-serv applic attempt singl sign-on approach program use unmanag c++ need determin current window user authent domain find know user authent allow desktop applic without requir password usernam app domain authent directli activ directori use adsopenobject requir usernam password privileg need usernam input user .net someth system.directoryservic thread far found task involv analyz window secur kerbero token properli thoroughli discuss thread touch upon java thread though need strict sso sinc app try access anyth relat domain sspi ticket exploit properti adsi/winlogon/credentialscach make work,0.17054263565891473,22,active-directory authentication c++ single-sign-on windows,determin log window account authent domain,11,authentication|signing|single-sign-on|password|username|privilege|security|kerberos|sso|exploit|credential,0.4811285734176636
