answers,creation_date,len,postid,question,ratio,raw,tags,title,uniq,words,probability
try kqoauth new qt librari oauth authent let user authent easili support oauth 1.0 hmac-sha1 extern depend http://www.johanpaul.com/blog/2010/10/introducing-kqoauth-easy-and-powerful-oauth-library-for-qt/ quick googl search gave qoauth qt lib liboath c base api use qoauth hack qoauth window far request token googl let user author it.but try access token oauth_verifi keep tell signatur invalid anyway use qoauth deal sp success qoauth solut find either made one https://github.com/pipacs/steps/tree/master/o2 base kqoauth test googl doc,2010-06-12 12:00:29.24 UTC,94,3028583,tri authent receiv publish googl buzz- qt 4.6c++ applic look cross-platform solut anyon provid work solut purpos,0.24468085106382978,23,api c++ oauth qt,oauth authent googl api qt,7,oauth|authentication|hmac|hack|authorise|signature|validate,0.4047188460826874
proxyus proxypass valu specifi usernam password forgot add valu works! proxi login box browser need webproxi class set credenti proxi url,2012-12-20 06:21:59.567 UTC,59,13966421,want make auto login system proxi proxi registri key valu want user applic enter login password browser want click login want automat tri proxyserv key work idea,0.1694915254237288,10,c++ proxy visual-c++ winapi,internet set registri - proxi auto login,5,login|password|username|forge|credential,0.40125319361686707
driver allow store user name password part dsn safe specifi uid pwd attribut creat dsn attribut specifi connect stage,2020-01-10 11:09:49,62,59680505,without user id password work user id password fail error messag invalid keyword-valu pair driver configdsn configdriv configtransl fail user id uid usernam uid field password pwd password field fail,0.16129032258064516,10,c++ sql-server winapi odbc,creat sql server dsn sqlconfigdatasourc fail invalid keyword-valu pair,5,validate|password|username|user name|safe,0.39802083373069763
see oracl call interfac programm guid - ocisessionbegin second type credenti support extern credenti attribut need user session handl call ocisessionbegin credenti type oci_cred_ext equival oracle7 connect / syntax valu oci_attr_usernam oci_attr_password ignor oci_cred_ext use,2011-03-31 05:09:02.43 UTC,89,5495559,basic c++ app login oracl db use oci.db configur authent user window domain user account moment client log pass user name password oci order login set oci_attr_password oci_attr_usernam attribut user session handl code make oci take window credenci directli instead provid code,0.1797752808988764,16,c++ oci oracle single-sign-on,autologin oracl use oci c++ use window credenti,8,single-sign-on|login|credential|authentication|user account|user name|password|username,0.3971068859100342
mention comment first learn basic sql queri let say tabl column custom app sql queri look code note assum learn purpos recommend store password hash rather plain text cheer,2018-05-12 22:20:43.787 UTC,67,50311120,want make app qt login regist system login password mysql databas connect databas app dont know compar login password given line edit code tutori tutori sqlite,0.14925373134328357,10,c++ database mysql qt qt5,qt mysql databas check login password sign,4,login|password|signing|hash,0.3963523209095001
write file system javascript browser think applic use client-serv architectur exampl client simpl html page input usernam password server save check user credenti case javascript send data page server,2016-11-09 17:35:50.023 UTC,100,40512869,possibl run exe c++ server/webpag make exe return respon convert exe c++ javascript? convert code javascript that? know basic javascript know read write .txt file basic code login system want websit mysql databas know slow probabl dumb project help appreciated! edit press login button prompt exe file see exe file send back server login success info exe file server client download code,0.13,13,c++ html javascript,execut .ex c++ html convert javascript,5,scripting|login|username|password|credential,0.3916003704071045
one easiest way see happen instal wireshark look data engin curl option entir sure think curl standard http authent know form login-form need send post request login form data login url - unless django web-appl provid differ login mechan usual case send post data django login form process success authent user back cooki store subsequ request note login form use tag mean send cooki token form data request django reject request suggest take look http request browser load submit login page modern browser nice debug tool monitor request altern case control django web-appl disabl csrf token valid view function login page state origin poster question solut realiz post curl c++ use django web-servic view disabl csrf,2013-01-21 12:40:15.683 UTC,169,14438843,tri creat c++ applic login django server look found solut specif question use one exampl libcurl websit request found option put user password problem know django recognis curl option posibl complet form django provid login form use option problem know complet form use c++ curl,0.11834319526627218,20,authentication c++ curl django,django authent curl c,6,authentication|login|password|cookie|csrf|validate,0.3830096423625946
inspect mod_auth_gssapi readi go web server apach web server,2019-03-05 16:40:41.583 UTC,76,55007614,c++ applic suppos kerbero authent access hdfs.thi applic webserv written c++ well tri make transpar authent applic kerbero ticket made server respons unauthor user http/1.1 401 unauthor www-authent negoti browser react author field header look author negoti yiiecgygkwybbqucoiid/jcca/qgcjaibg. point got confus negoti browser proper kerbero ticket understand gssapi kerberos5 librari process negoti acquir ticket idea achiev,0.19736842105263158,15,c++ gssapi kerberos spnego,usag spnego c++ applic acquir kerbero ticket,4,kerberos|spnego|authentication|authorise,0.3822323977947235
ok figur gss-api includ api call directli obtain tgt st need krb apiin case underli kerbero mechan typic need function like:- along certain context credenti cach princip initi part,2013-03-20 09:30:41.933 UTC,128,15519710,develop c++ client use gssapi login server credenti use gss method build credenti objectexplain code code part print major statusgssapi level statu minor statusmechan level status- kerbero case give log useri. asany statu printf messag give 0 valuesal goe well howev differ usernamethi one regist activ directori log get investig reveal minor statu messag correspond error certain pass correct credentialsusernam password non log user someth wrong gssapi internallymayb unabl ticket someth make mistake? configur use window activ directori window server 2008 mit kerbero librari - version 4.0.1,0.1171875,15,c++ gssapi kerberos,gssapi usernam password build credenti work non log user,5,kerberos|username|password|credential|login,0.3811008930206299
quit close concaten usernam password must encod base64 put header exampl login user password pass send edit respons alway look http version actual use a.o.t request though mostli result code textual represent result code result code e.g 401 unauthor constant textual represent inform differ variou system,2015-11-18 00:01:25.423 UTC,100,33769432,tri post method look ton resourc still figur http command send password usernam server authent know ask similar question got rfc 2016 answer still need help http messag send right now. oh anybodi know respons messag password incorrect think look someth follow realli unsur,0.13,13,authentication c++ http,http command send usernam password web server,6,authentication|username|password|encode|login|authorise,0.37610891461372375
,2018-04-26 05:50:37.08 UTC,73,50035674,problem store procedur execut code use window authent process run system account.it execut store procedur work fine login window administrator.but log window anoth user administr permiss deni error solv ad user sql server login grant execut permiss doubt work even process run system account.do admin privilege? part sql server login sp execut vbs via wscript cmd made run administr even login window anoth user,0.1232876712328767,9,authentication c++ sql-server windows,system user sql server authent,4,authentication|login|privilege|scripting,0.3729647994041443
,2018-01-26 13:11:30.24 UTC,83,48462026,tri access protect site use basic rest requests.th site requir .i site read need privat key authent request use smartcard allow privat key smartcard anyon know googl chrome internet explor microsoft edg request access sites? firefox seem work smartcard-read know use window keep mind smartcard authent site rest endpoint follow alreadi tri privat key smartcard attach request pretti sure miss import step realli find use inform c++ x.509 client authent use smartcard,0.13253012048192772,11,c++ client-certificates qnetworkaccessmanager qt smartcard,qt x.509 client authent use smartcard,5,certificate|x.509|authentication|protect|private key,0.372963547706604
feel get call main function password usernam incorrect side note want chang &amp;&amp check || want access deni either password usernam incorrect want consid get initiallogin function return bool show weather login success run initiallogin success proceed code place call initiallogin loop repeat while!initiallogin{} initiallogin fals bad login try true good login continu onto next section code function attempt call legal c++ return statu see login work loop statu either becom true user run chanc small exampl,2014-08-29 15:34:23.847 UTC,132,25571559,ok im kinda new c++ im tri build basic login program iv got work except one problem. iv got run login successful follow run screen cleard. problem usernam password wrong say initi output twice wrong twice output three time need know clear overflow buffer something...pleas help,0.13636363636363635,18,c++ codeblocks windows,basic c++ cout buffer overflow think,4,buffer overflow|login|username|password,0.37238064408302307
sever issu code url wrong login right url https://de.ogame.gameforge.com/main/login post messag right format need handl cooki cooki use save login session without cooki redirect main page everytim make request ogam curl code work login ogam global defin code html code store string htmlcode my%40email.her chang email %40 @ mypassword chang password s148-de.ogame.gameforge.com depend univers play 148 virgo know tri suggest program intercept html requests/respons chrome go devtool overview shortcut f12 network track exchang browser server try mimic,2017-04-15 17:26:53.553 UTC,109,43429079,problem.i want login e.g ogam read url sourc code it.but everytim start code file return login page second page login fine help good day,0.13761467889908258,15,c c++ curl,login page read url content,4,login|forge|cookie|password,0.36566638946533203
,2019-05-13 13:45:23.07 UTC,56,56113710,develop qt applic want googl authent creat googl api explain follow link https://blog.qt.io/blog/2017/01/25/connecting-qt-application-google-services-using-oauth-2-0/ problem work mani case protocolinvalidoperationerror 302 error https://accounts.google.com/o/oauth2/token request url qoauthhttpserverreplyhandler::networkreplyfinishedqnetworkrepli *repli method qt class note overrid qoauthhttpserverreplyhandler::networkreplyfinishedqnetworkrepli *repli error emit signal case return valu reply->readal login.cpp code someth problem? thank help,0.23214285714285715,13,c++ google-oauth2 oauth qt,invalid grant issu googl oauth authent qt,5,oauth|validate|authentication|signing|login,0.3655819296836853
exampl maximumpasswordag,2013-03-12 10:02:59.523 UTC,22,15358179,inform password policy? password length max password age etc tri look registri find look,0.2727272727272727,6,c++ passwords windows,inform password polici,1,password,0.3652685284614563
signal slot mechan qt creat signal login class slot admin_panel put qobject::connect.. main.cpp emit slot usernam login,2017-05-21 12:48:21.887 UTC,62,44097053,creat login page person enter usernam password access given want pass usernam next open form order make person dash board code admin_panel.cpp admin_panel.h file login.h file login.cpp file main.cpp success login login.cpp file pass usernam admin_panel.cpp later label,0.22580645161290322,14,c++ qt,pass variabl one form form,4,login|username|password|signing,0.3636358082294464
,2017-03-31 17:10:51.583 UTC,47,43146229,someon help simpl exampl authent java sasl server window c++ client window api mean use acquirecredentialshandl initializesecuritycontext. best result got moment configur ss result ok scret sec_i_continue_need outbuffers[0] empti noth send server continu authent procedur,0.1276595744680851,6,authentication c++ sasl sspi windows,exampl c++ client digest-md5 sasl auth window,4,authentication|md5|credential|security,0.36203110218048096
try straight mitm cert fulli control make sure ocsp/perspectives/converg stuff meddl thing mayb add cert os trust root think ff window use window cert store start->run->certmgr.msc worth tri someth burp see error local sslsniff mitm attempt session encod length error messag cach ssl session fail mean ssl session resumpt subsequ connect fail result degrad perform full ssl handshak need done everi request howev despit use cpu heavili sslsniff still work fine cach fail serial represent openssl session object ssl_session larger maximum size support sslsniff session cach real problem note sslsniff support x.509v3 subjectaltnam connect site whose hostnam match subject common name certif instead match subjectaltnam sslsniff gener forg certif without subjectaltnam caus hostnam verif mismatch connect client problem happen specif site let us know site examin server certif use e.g happen site explan,2012-02-22 13:43:08.287 UTC,311,9395990,tri sslsniff tool technic issues. look similar problem result twitter feed public use answer version sslsniff 0.8 launch sslsniff arg cert_and_key.pem file author certif concaten unencrypt privat key pem format cours 12345 port redirect traffic iptabl rule sslsniff correctli run [and anytim connect client 2 follow lines:] client side regist ac trust ca ff connect ssl error super strang moreov fact certif automat accept sinc sign trust ca cannot accept forg certif click add exception. alway return error page ask add anoth exception. moreov try connect exampl https://www.google.com sslsniff log complet new line anyon know wrong? -- edit summer differ answer -- problem sslsniff take care altern name forg certif appar firefox refus certif soon common name match exactli domain name exampl google.com cn = www.google.com altern name connect https://www.google.com work fine google.fr cn = *.google.fr altern name *.google.fr google.fr connect https://www.google.fr ff look altern name sinc obvious find refus malform certif . solut patch/commit. know moxi marlinspik intent forgot functionn complic awar issu anyway try look code,0.19292604501607716,60,c++ cryptography openssl security ssl,sslsniff error ssl accept fail,16,crypt|openssl|ssl|security|snif|authorise|certificate|encrypt|private key|trust|signing|forge|mitm|burp|encode|x.509,0.3589542806148529
work two practic seen entiti person thing busi depend level granular need access databas credenti use mssql rocket univers databas mostli retail legaci softwar host applic separ authent system user databas credenti store server applic host client know noth back databas usual web app web servic someth done mani applic actual talk rest servic emul databas applic access databas read wikipedia articl rest servic inform authent done use nonc encod hmac request user given key tie credenti wrap databas web servic give possibl advantag decid chang databas structur keep inform even need updat client applic servic credenti never leav server credenti remain safe long nobodi gain access server secur gener increas servic cleverli enough even transfer much intern logic normal client side onto server make updat bugfix virtual seamless client disadvantag see one thing maintain applic vulner denial servic attack sinc databas possibl problem anyway server goe client applic go still problem anyway rest architectur http://en.wikipedia.org/wiki/representational_state_transf hmac http://en.wikipedia.org/wiki/hash-based_message_authentication_cod hmac system work user log use usernam password local applic local applic commun authent servic get session key share secret usernam password use session key expir short period time applic creat api key last long time store comput session key use instead api key user requir log time mainli conveni program comput secur session key use api key store local machin time user log new session key request databas servic accompani hmac-sign nonc applic get author servic base api key get nonc applic sign use share secret sign request use sinc web servic user know noth authent request sign nonc authent server-sid see hash nonc particular api/sess key share secret result digest nonc mark expir request grant vulner man-in-the-middl attack http use often peopl make messag base nonc url request along timestamp comput hmac server recreat messag base url check see timestamp within bound +/- 4min someth author user base inform granul oper role system check see user own session/api key given permiss request thing request appropri role request grant summari credenti done user-by-us end user knowledg databas web servic wrap databas rest api role base system use make permiss granular suggest say best happen end work let look two way deal databas client directli connect databas manipul databas server connect databas provid interfac client consid case valid valid serial number store/read inform certain user design follow provid secur expert client directli connect databas manipul databas admin visit databas instead creat user client limit user access privileg view certain data enforc secur polici databas chang privileg user consult mysql mysql 5.1 refer manual 6 secur info 6.2 mysql access privileg system 6.3 mysql user account manag server connect databas provid interfac client http provid interfac client backend connect databas someth rest api mani easi framework provid authent author think good idea let client direct access databas case possibl second option better note password base authent ideal @percept note best bet implement web servic front mysql want unknown number client unknown ip address access databas realli easi dos attack tie mysql connect mention sever limit abil scale backend servic meet demand increas client base without web servic web servic offer abil control user authent author number way user/pass combin token-bas access oauth access etc,2013-03-19 00:19:12.637 UTC,702,15489360,need creat applic compani peopl login applic differ permiss perform differ task initi idea creat mysql databas hardcod credenti applic applic connect mysql databas mysql databas tabl call user store usernam password permiss applic queri server perform authent biggest problem mysql credenti hard code applic applic get wrong hand lot damag mysql databas snoop around find credenti start drop tabl thought develop server act interfac mysql databas exampl client applic connect server via tcp server connect mysql databas mysql credenti never expos end-us howev mean develop server applic harder maintain deploy custom oppos set mysql server bha potenti introduc bug sinc addit system need make relat back point deploy bug fix etc think instead tabl user databas applic connect directli mysql server hardcod credenti end-us given actual mysql user credenti enter applic connect mysql server mean someon get hand applic damag mysql databas still remain risk end-us give credenti wrong person best way desktop applic connect mysql database? solut 3 thought thought solut,0.10683760683760683,75,c++ desktop-application mysql security,hide mysql credenti applic,19,security|credential|login|username|password|authentication|nonce|encode|hmac|safe|vulnerability|attack|hash|signing|authorise|validate|privilege|user account|oauth,0.35567089915275574
found problem select client machin machin old certif download certif store cert like download past old expir certif invalid reason machin decid download certif instead new one server valid expir date delet old certif fix problem base comment question realiz sha-1 offici deprec googl microsoft jan 2017 understand server need updat time order certif use valid signatur see warn server use weak signatur sha-1 deni request altogeth hth,2016-02-16 20:36:08.01 UTC,152,35442465,work window desktop app written c++ mfc librari creat web request web request succeed 90% custom machin - window xp 10 10% custom machin fail say sha-1 weak signatur algorithm app fail connect control chang sha-1 certif server robust certif verifi app fail reject certif ie/security/network setting? know chang code ignor invalid certif undermin qualiti secur applic want anyon suggest custom chang internet set someth els make app work? thank advanc,0.18421052631578946,28,c++ https security sha1 ssl,c++ mfc sha-1 weak signatur algorithm unabl connect,6,security|sha|ssl|signature|certificate|validate,0.35174626111984253
consid use store credenti altern place main three authent mechan roughli order popular password somehow load password applic whenev connect databas one easi store password text file protect filesystem permiss similar protect ssh privat key ldap requir ldap server network commonplac corpor environ requir load password applic differ regular password mechan databas server store credenti verifi password directly--it deleg ldap server kerbero requir kerbero server network applic need load password instead user servic account run applic must first authent use kerbero either type password load credenti file person prefer kerbero servic support network question second best ldap allow central control thing password chang revoc third regular password mechan work environ detail avail mechan https://www.postgresql.org/docs/10/static/auth-methods.html cannot user direct access applic directli launch everyth hardcod applic seen access user whatev obfusc determin attack abl find decompil debugg break point exist differ typic case web applic user access applic code launch databas password lie configur file - alway access administr even run machin decent os allow access protect prevent unprivileg user access backend program latter case front end backend commun socket name pipe messag almost ipc mechan tl/dr secur split applic front end run user account knowledg databas server back end run system non admin user ensur normal user access backend applic file store databas password configur file backend never sourc file,2018-06-14 12:58:37.367 UTC,251,50858164,applic script creat conceptu model login role postgresql database.thi login role use applic everyth independ log applic user protect login role password insid applic code,0.18326693227091634,46,c++ postgresql security,protect password system databas,17,security|protect|password|scripting|login|credential|authentication|ssh|private key|ldap|delegation|kerberos|availability|obfuscate|attack|privilege|user account,0.3509698212146759
got work use follow solut function callback qnetworkreply::finish add cooki,2016-04-30 12:26:08.257 UTC,77,36954933,besic post usernam password site say http://example.org/signup.asp cooki wanna save object qnetworkaccessmanag problem 1 first issu save cooki correspond url say say http://example.org/signup.asp cannot retriev back via http://example.org/ http://example.org/something_els problem 2 second one even cooki root hostnam say http://example.org/ still cannot retriev via url note check qt http post issu server requir cooki save cooki qt? work think ideas? thank,0.18181818181818182,14,c++ cookies network-programming qt,setcookiesfromurl cookiesforurl qnetworkcookiejar,4,cookie|username|password|signing,0.34997525811195374
libopkel help you? question configur error,2010-07-14 18:11:07.19 UTC,123,3249100,plan openid client multiplay network c++ game hoster option allow login peopl authent via openid want make possibl allow certain peopl login alreadi simpl html viewer code plan migrat webkit display html openid endpoint login realli problem code http request alreadi migrat libcurl found c++ code rest actual openid endpoint handshak c++ code this? good point start? realli much idea openid intern complic code myself? possibl this? think seen must put authent site url openid endpoint return login success case site login via openid gameserv realli problem webserv one forum sourceforg one stuff howev huge drawback game depend websit openid login bad -- one nice advantag openid gone,0.17073170731707318,21,c++ multiplayer openid,openid authent c++ multiplay network game,4,openid|authentication|login|forge,0.3473128080368042
sso mean one password begin day none leav ldap easili alon help consolid password rememb one nice still enter repeatedli unless lot engine top kerbero actual sso caveat opinion applic need support special degre far ldap store credenti kerbero sure win suspect store credenti cleartext order compat kerbero make nervou servic network access contain cleartext password clear better kerbero databas store password hope help experi kerbero sidelin read _a_lot_ never actual use,2011-06-28 03:10:49.417 UTC,104,6501145,build sso solut openldap only? sso need least openldap + kerbero someth like? openldap ok credenti current user authent applic ldap api? c++ api,0.2692307692307692,28,c++ ldap linux single-sign-on,build sso solut openldap,7,ldap|single-sign-on|sso|kerberos|credential|authentication|password,0.34691646695137024
