Topic ID,Top Words,Category,Sub-Category,Specifics
TOPIC 0,jenkin node credenti build master plugin ssh slave hadoop job ,Development,Configuration,Server Configuration
TOPIC 1,password charact string use quot tri line gener usernam number,Authentication,Login,Credentials
TOPIC 2,svn telnet exit signal process statu child subver grep parent,Development,Configuration,Version Control / Signal Handling
TOPIC 3,rubi info postgresql laravel forg net-ssh gem version net::ssh queri ,Development,Implementation,Database Query
TOPIC 4,key public ssh privat server use gener authent file rsa ,Cryptography,Algorithms,Public and Private Key Cryptography
TOPIC 5,user root login password run ssh sudo access account log ,Authentication,Login,
TOPIC 6,file sftp use php code work tri server error support ,Network Security,File Transfer,
TOPIC 7,password script command run prompt bash expect use ssh enter ,Network Security,Remote Access,
TOPIC 8,hash curl encod valu bash use md5 string base64 cooki ,Cryptography,Encryption,
TOPIC 9,script bash shell command file variabl run execut environ pass ,Development,Configuration,Environment Setup
TOPIC 10,window putti openssh cygwin instal linux puttygen powershel pi pageant ,Development,Configuration,Windows Environment Setup
TOPIC 11,ssh connect host tri use server error authent fail work ,Authentication,Access Control,
TOPIC 12,ssh file server tri key directori work copi permiss problem ,Authentication,Access Control,Permissions
TOPIC 13,java jsch algorithm librari exchang code version support applic client ,Development,Configuration,Java Development
TOPIC 14,debug1 type file ident packet authent receiv sent publickey version ,Network Security,File Transfer,SSH Connection
TOPIC 15,ssh connect tunnel server port use access mysql ip secur ,Network Security,Remote Access,
TOPIC 16,encrypt certif openssl decrypt ssl use sign secur client signatur ,Network Security,Digital Certificates,
TOPIC 17,python paramiko app devic librari c# code modul subprocess android ,Development,Libraries,Python App Development
TOPIC 18,cipher intellij checkout wordpress ide subdomain curv sublim idea pxssh ,Development,Libraries,
TOPIC 19,ssh server remot command machin use run script file connect ,Network Security,Remote Access,
TOPIC 20,vm googl comput cloud instanc click engin gcloud log consol ,Development,Libraries,Google Cloud
TOPIC 21,instanc ssh ec2 permiss ubuntu aw deni tri key file ,Authentication,Access Control,
TOPIC 22,git ssh github repositori key use clone repo work tri ,Development,GitHub/Reports,
