Topic ID,Top Words,Category,Sub-Category,Specifics
TOPIC 0,valid error function field valu object method return type form ,Development,Implementation,
TOPIC 1,password user usernam credenti email brave account chang login save ,Authentication,Login,password ui features
TOPIC 2,script html inject js content load page code tag leak ,Network Security,Exploits,html injection
TOPIC 3,test fix chang updat merg commit pull request add ad ,Development,Testing,secuirty pull request implementation
TOPIC 4,use think need make secur want work user case know ,Development,Implementation,security design
TOPIC 5,encod url hash decod string charact use valu par function ,Cryptography,Encoding,encode/decode (code security)
TOPIC 6,key encrypt data decrypt privat use ae public transport secret ,Cryptography,Encryption,
TOPIC 7,user ldap authent chat login com auth behavior log server ,Authentication,Access Control,web/ldap authentication
TOPIC 8,cooki request token header authent server session use domain api ,Authentication,Tokens,
TOPIC 9,certif server connect ssl error cert work self use tl ,Network Security,Digital Certificates,
TOPIC 10,file hash asset upload cach plugin config gener download js ,Network Security,File Transfer,File hash and transfer
TOPIC 11,version open bug plea reproduc close step activ browser automat ,Development,GitHub/Reports,
TOPIC 12,login log app page oauth work redirect authent servic googl ,Authentication,Login,managing user accounts
TOPIC 13,sign signatur cla thank email verifi plea author address request ,Development,Implementation,security pull request implementation (googlebot )
TOPIC 14,view github whitelist signal repli email directli thread receiv amp ,Authentication,Access Control,whitelist and blacklist implmentation
TOPIC 15,vulner secur packag version sandbox npm fix audit depend instal ,Network Security,Exploits,vulnerabilities fix
TOPIC 16,node js modul default crypto build ssh lib version command ,Development,Libraries,Node.js crypto security problem
